{
  "event_id": "6f1c2f0e-3a55-4a7e-9d1a-2b8c5e0a1001",
  "type": "session.started",
  "schema_version": 1,
  "occurred_at": "2026-01-15T09:00:00Z",
  "session_id": "sess_demo_001",
  "data": {
    "session_id": "sess_demo_001",
    "child_ref": "child_demo_001",
    "passage_id": "bank_p3_market_day",
    "context": "SCHOOL",
    "voice_profile_id": "voice_demo_a",
    "voice_mode": "cache_first",
    "session_profile": "standard"
  }
}
