{
  "event_id": "6f1c2f0e-3a55-4a7e-9d1a-2b8c5e0a1003",
  "type": "session.done",
  "schema_version": 1,
  "occurred_at": "2026-01-15T09:08:30Z",
  "session_id": "sess_demo_001",
  "data": {
    "session_id": "sess_demo_001",
    "turn_audio_uris": [
      {
        "turn_id": "turn_001",
        "phase": "READING",
        "audio_uri": "gs://aloai-dev-audio/3f2b9c1e-7d44-4c0b-8a52-0e6f1d9a7b10/READING/a1b2c3d4-0000-4000-8000-000000000001.flac"
      },
      {
        "turn_id": "turn_002",
        "phase": "RETELL",
        "audio_uri": "gs://aloai-dev-audio/3f2b9c1e-7d44-4c0b-8a52-0e6f1d9a7b10/RETELL/a1b2c3d4-0000-4000-8000-000000000002.flac"
      },
      {
        "turn_id": "turn_003",
        "phase": "QUESTION",
        "audio_uri": "gs://aloai-dev-audio/3f2b9c1e-7d44-4c0b-8a52-0e6f1d9a7b10/QUESTION/a1b2c3d4-0000-4000-8000-000000000003.flac"
      }
    ],
    "capture_mode": "LIVE",
    "session_settings": {
      "voice_mode": "cache_first",
      "session_profile": "standard"
    },
    "flags": ["LIVE_FALLBACK"],
    "listening_module_run": false
  }
}
