{
  "event_id": "6f1c2f0e-3a55-4a7e-9d1a-2b8c5e0a1002",
  "type": "phase1.recorded",
  "schema_version": 1,
  "occurred_at": "2026-01-15T09:03:10Z",
  "session_id": "sess_demo_001",
  "data": {
    "session_id": "sess_demo_001",
    "audio_uri": "gs://aloai-dev-audio/3f2b9c1e-7d44-4c0b-8a52-0e6f1d9a7b10/READING/a1b2c3d4-0000-4000-8000-000000000001.flac",
    "passage_id": "bank_p3_market_day",
    "told_token_indices": [14]
  }
}
